[
  {
    "date": "2026-01-01",
    "records": [
      {
        "category": "餐饮",
        "amount": 136.0,
        "description": "酒店早餐自助",
        "time": "07:30"
      },
      {
        "category": "餐饮",
        "amount": 302.0,
        "description": "法式餐厅午餐",
        "time": "12:00"
      },
      {
        "category": "餐饮",
        "amount": 956.0,
        "description": "和同事吃饭",
        "time": "19:00"
      },
      {
        "category": "交通",
        "amount": 133.0,
        "description": "停车费",
        "time": "08:30"
      },
      {
        "category": "通讯",
        "amount": 399.0,
        "description": "手机话费",
        "time": "10:00"
      },
      {
        "category": "住房",
        "amount": 25000.0,
        "description": "房贷",
        "time": "09:00"
      },
      {
        "category": "社交",
        "amount": 1694.0,
        "description": "聚会AA",
        "time": "17:00"
      }
    ],
    "daily_total": 28620.0,
    "monthly_income": 830000
  },
  {
    "date": "2026-01-02",
    "records": [
      {
        "category": "餐饮",
        "amount": 102.0,
        "description": "精品烘焙坊",
        "time": "07:30"
      },
      {
        "category": "餐饮",
        "amount": 202.0,
        "description": "精品中餐",
        "time": "12:00"
      },
      {
        "category": "交通",
        "amount": 129.0,
        "description": "停车费",
        "time": "08:00"
      },
      {
        "category": "购物",
        "amount": 4033.0,
        "description": "机械键盘",
        "time": "14:00"
      }
    ],
    "daily_total": 4466.0,
    "monthly_income": 830000
  },
  {
    "date": "2026-01-03",
    "records": [
      {
        "category": "餐饮",
        "amount": 55.0,
        "description": "手冲咖啡+可颂",
        "time": "07:30"
      },
      {
        "category": "餐饮",
        "amount": 548.0,
        "description": "精品咖啡厅",
        "time": "11:30"
      },
      {
        "category": "交通",
        "amount": 73.0,
        "description": "打车",
        "time": "08:30"
      },
      {
        "category": "娱乐",
        "amount": 242.0,
        "description": "游泳",
        "time": "6:00"
      }
    ],
    "daily_total": 918.0,
    "monthly_income": 830000
  },
  {
    "date": "2026-01-04",
    "records": [
      {
        "category": "餐饮",
        "amount": 87.0,
        "description": "星巴克精品咖啡+早餐",
        "time": "07:30"
      },
      {
        "category": "餐饮",
        "amount": 464.0,
        "description": "日式居酒屋",
        "time": "11:30"
      },
      {
        "category": "交通",
        "amount": 52.0,
        "description": "专车",
        "time": "08:30"
      },
      {
        "category": "娱乐",
        "amount": 2666.0,
        "description": "spa按摩",
        "time": "11:00"
      },
      {
        "category": "娱乐",
        "amount": 482.0,
        "description": "瑜伽课",
        "time": "7:00"
      }
    ],
    "daily_total": 3751.0,
    "monthly_income": 830000
  },
  {
    "date": "2026-01-05",
    "records": [
      {
        "category": "餐饮",
        "amount": 149.0,
        "description": "手冲咖啡+可颂",
        "time": "07:00"
      },
      {
        "category": "餐饮",
        "amount": 415.0,
        "description": "精品中餐",
        "time": "12:30"
      },
      {
        "category": "餐饮",
        "amount": 873.0,
        "description": "商务晚餐",
        "time": "19:30"
      },
      {
        "category": "交通",
        "amount": 74.0,
        "description": "专车",
        "time": "08:00"
      },
      {
        "category": "娱乐",
        "amount": 320.0,
        "description": "瑜伽课",
        "time": "6:00"
      }
    ],
    "daily_total": 1831.0,
    "monthly_income": 830000
  },
  {
    "date": "2026-01-06",
    "records": [
      {
        "category": "餐饮",
        "amount": 95.0,
        "description": "有机果汁+牛油果吐司",
        "time": "07:30"
      },
      {
        "category": "餐饮",
        "amount": 410.0,
        "description": "日料omakase",
        "time": "12:00"
      },
      {
        "category": "餐饮",
        "amount": 810.0,
        "description": "和同事吃饭",
        "time": "19:00"
      },
      {
        "category": "交通",
        "amount": 75.0,
        "description": "停车费",
        "time": "08:00"
      },
      {
        "category": "购物",
        "amount": 7778.0,
        "description": "机械键盘",
        "time": "18:00"
      }
    ],
    "daily_total": 9168.0,
    "monthly_income": 830000
  },
  {
    "date": "2026-01-07",
    "records": [
      {
        "category": "餐饮",
        "amount": 118.0,
        "description": "有机果汁+牛油果吐司",
        "time": "07:15"
      },
      {
        "category": "餐饮",
        "amount": 341.0,
        "description": "高端商务午餐",
        "time": "12:30"
      },
      {
        "category": "餐饮",
        "amount": 723.0,
        "description": "日料",
        "time": "19:30"
      },
      {
        "category": "交通",
        "amount": 110.0,
        "description": "打车",
        "time": "08:00"
      }
    ],
    "daily_total": 1292.0,
    "monthly_income": 830000
  },
  {
    "date": "2026-01-08",
    "records": [
      {
        "category": "餐饮",
        "amount": 383.0,
        "description": "日料omakase",
        "time": "12:00"
      },
      {
        "category": "交通",
        "amount": 124.0,
        "description": "打车",
        "time": "08:00"
      },
      {
        "category": "购物",
        "amount": 4219.0,
        "description": "机械键盘",
        "time": "16:00"
      }
    ],
    "daily_total": 4726.0,
    "monthly_income": 830000
  },
  {
    "date": "2026-01-09",
    "records": [
      {
        "category": "交通",
        "amount": 146.0,
        "description": "打车",
        "time": "08:00"
      }
    ],
    "daily_total": 146.0,
    "monthly_income": 830000
  },
  {
    "date": "2026-01-10",
    "records": [
      {
        "category": "餐饮",
        "amount": 1304.0,
        "description": "红酒晚宴",
        "time": "19:00"
      },
      {
        "category": "交通",
        "amount": 66.0,
        "description": "专车",
        "time": "08:30"
      }
    ],
    "daily_total": 1370.0,
    "monthly_income": 830000
  },
  {
    "date": "2026-01-11",
    "records": [
      {
        "category": "餐饮",
        "amount": 128.0,
        "description": "手冲咖啡+可颂",
        "time": "07:00"
      },
      {
        "category": "餐饮",
        "amount": 2014.0,
        "description": "私房菜",
        "time": "19:30"
      },
      {
        "category": "交通",
        "amount": 69.0,
        "description": "打车",
        "time": "08:00"
      },
      {
        "category": "购物",
        "amount": 2581.0,
        "description": "手表表带",
        "time": "17:00"
      },
      {
        "category": "娱乐",
        "amount": 1791.0,
        "description": "红酒品鉴",
        "time": "15:00"
      }
    ],
    "daily_total": 6583.0,
    "monthly_income": 830000
  },
  {
    "date": "2026-01-12",
    "records": [
      {
        "category": "餐饮",
        "amount": 118.0,
        "description": "酒店早餐自助",
        "time": "07:00"
      },
      {
        "category": "交通",
        "amount": 147.0,
        "description": "专车",
        "time": "08:00"
      }
    ],
    "daily_total": 265.0,
    "monthly_income": 830000
  },
  {
    "date": "2026-01-13",
    "records": [
      {
        "category": "餐饮",
        "amount": 120.0,
        "description": "手冲咖啡+可颂",
        "time": "07:00"
      },
      {
        "category": "餐饮",
        "amount": 464.0,
        "description": "精品中餐",
        "time": "12:15"
      },
      {
        "category": "餐饮",
        "amount": 718.0,
        "description": "商务晚餐",
        "time": "19:00"
      },
      {
        "category": "交通",
        "amount": 80.0,
        "description": "停车费",
        "time": "08:00"
      }
    ],
    "daily_total": 1382.0,
    "monthly_income": 830000
  },
  {
    "date": "2026-01-14",
    "records": [
      {
        "category": "餐饮",
        "amount": 139.0,
        "description": "精品烘焙坊",
        "time": "07:15"
      },
      {
        "category": "餐饮",
        "amount": 482.0,
        "description": "米其林套餐",
        "time": "12:30"
      },
      {
        "category": "交通",
        "amount": 105.0,
        "description": "停车费",
        "time": "08:30"
      }
    ],
    "daily_total": 726.0,
    "monthly_income": 830000
  },
  {
    "date": "2026-01-15",
    "records": [
      {
        "category": "餐饮",
        "amount": 120.0,
        "description": "星巴克精品咖啡+早餐",
        "time": "07:15"
      },
      {
        "category": "餐饮",
        "amount": 491.0,
        "description": "精品中餐",
        "time": "12:30"
      },
      {
        "category": "餐饮",
        "amount": 799.0,
        "description": "商务晚餐",
        "time": "19:30"
      },
      {
        "category": "交通",
        "amount": 143.0,
        "description": "打车",
        "time": "08:30"
      },
      {
        "category": "娱乐",
        "amount": 225.0,
        "description": "健身房私教",
        "time": "7:00"
      },
      {
        "category": "日用",
        "amount": 164.0,
        "description": "高端纸巾",
        "time": "19:00"
      }
    ],
    "daily_total": 1942.0,
    "monthly_income": 830000
  },
  {
    "date": "2026-01-16",
    "records": [
      {
        "category": "餐饮",
        "amount": 418.0,
        "description": "精品中餐",
        "time": "12:30"
      },
      {
        "category": "餐饮",
        "amount": 472.0,
        "description": "商务晚餐",
        "time": "19:00"
      },
      {
        "category": "交通",
        "amount": 122.0,
        "description": "打车",
        "time": "08:00"
      },
      {
        "category": "购物",
        "amount": 4163.0,
        "description": "定制西装",
        "time": "17:00"
      },
      {
        "category": "社交",
        "amount": 2805.0,
        "description": "送同事礼物",
        "time": "17:00"
      },
      {
        "category": "日用",
        "amount": 153.0,
        "description": "进口水果",
        "time": "19:00"
      }
    ],
    "daily_total": 8133.0,
    "monthly_income": 830000
  },
  {
    "date": "2026-01-17",